{
  "title": "NICOLE",
  "leseverstehen_teil_1": {
    "headings": {
      "a": "Sportkurse für ältere Menschen",
      "b": "Für Jugendliche ist der Computer etwas Alltägliches",
      "c": "Das Interesse am Handel über Internet nimmt stark ab",
      "d": "Arbeiten am Computer verursacht häufig Rückenschmerzen",
      "e": "Internetnutzer machen viele Dinge gleichzeitig",
      "f": "Firmen müssen auch über Internet für Produkte werben",
      "g": "Auch Freizeitsportarten sollten trainiert werden",
      "h": "Was man gegen Rückenschmerzen tun kann",
      "i": "Kinder wollen mit dem Computer nur spielen",
      "j": "Internetnutzer interessieren sich nicht fürs Fernsehen"
    },
    "headings_en": {
      "a": "Sports courses for older people",
      "b": "For young people, the computer is something everyday",
      "c": "Interest in internet trade is decreasing sharply",
      "d": "Working at the computer often causes back pain",
      "e": "Internet users do many things at the same time",
      "f": "Companies must also advertise products via the internet",
      "g": "Leisure sports should also be trained",
      "h": "What you can do against back pain",
      "i": "Children only want to play with the computer",
      "j": "Internet users are not interested in television"
    },
    "passages": [
      {
        "number": 1,
        "text": "Falsche Körperhaltung, mangelnde Bewegung und psychische Faktoren sind meistens die Hauptfaktoren für Rückenschmerzen. Hier finden Sie ein ganzheitliches Trainingsprogramm, mit dem Sie Ihre Schmerzen verringern. Alle Übungen lassen sich leicht in den Alltag integrieren. Warenkunde der Farbabbildungen, 18x25 cm, gebunden.",
        "text_en": "Poor posture, lack of movement, and psychological factors are mostly the main factors for back pain. Here you will find a holistic training program with which you can reduce your pain. All exercises can be easily integrated into everyday life. Merchandise knowledge of the color illustrations, 18x25 cm, hardcover.",
        "correct_answer": "h",
        "explanation": "The text describes a training program ('Trainingsprogramm') to reduce back pain ('Rückenschmerzen'). This matches heading 'h' (What you can do against back pain).",
        "vocabulary": [
          {
            "de": "die Körperhaltung",
            "en": "the posture"
          },
          {
            "de": "verringern",
            "en": "to reduce"
          }
        ]
      },
      {
        "number": 2,
        "text": "Der Computer gehört heute wie selbstverständlich in das Jugendzimmer. Wie früher die Modelleisenbahn oder die Barbie-Puppe. Was aber genau treiben die Kids mit den hochgerüsteten Rechenmaschinen auf dem Schreibtisch? Das wollte die Jugendzeitschrift Bravo wissen. Selbstverständlich spielen, aber auch andere, nützlichere Dinge wie Texte schreiben oder Hausaufgaben für die Schule erledigen, Tabellen erstellen - und natürlich im Internet herumsurfen.",
        "text_en": "Today, the computer belongs in the teenager's room as a matter of course. Like the model railway or the Barbie doll in the past. But what exactly do the kids do with the highly upgraded calculating machines on the desk? The youth magazine Bravo wanted to know. Of course playing, but also other, more useful things like writing texts or doing homework for school, creating tables - and of course surfing around on the internet.",
        "correct_answer": "b",
        "explanation": "The text states that computers are now naturally part of a youth's room ('wie selbstverständlich in das Jugendzimmer'), comparing it to classic toys. This perfectly matches 'b' (For young people, the computer is something everyday).",
        "vocabulary": [
          {
            "de": "selbstverständlich",
            "en": "as a matter of course / naturally"
          },
          {
            "de": "hochgerüstet",
            "en": "highly upgraded"
          }
        ]
      },
      {
        "number": 3,
        "text": "Inline-Skating ist ein idealer Ausdauersport, nicht nur für die jüngere Generation. Das haben jetzt Untersuchungen am Institut für Sportwissenschaften an der Universität Frankfurt bestätigt. Danach trainiert Inline-Skating das Herz-Kreislauf-System, beansprucht die wichtigsten Muskelgruppen und fördert die Koordination. Die Faszination dieser rasanten Freizeitsportart wirke generationenübergreifend und erfasst die Jungen wie die Alten, sagt Dr. Hans Jürgen Ahrens. Allerdings fragt der Arzt kritisch, warum jeder Skifahrer, Windsurfer oder Tennisspieler zu Beginn Trainingsstunden bei einem Profi belege, oft aber nicht der Inliner: Dabei lässt sich das Verletzungsrisiko durch regelmäßiges Fahrtraining deutlich verringern. In einem Kurs sollten die wichtigsten Sturz-, Brems- und Fahrtechniken erlernt werden.",
        "text_en": "Inline skating is an ideal endurance sport, not just for the younger generation. This has now been confirmed by studies at the Institute for Sports Science at the University of Frankfurt. According to this, inline skating trains the cardiovascular system, stresses the most important muscle groups and promotes coordination. The fascination of this fast-paced leisure sport works across generations and captivates the young as well as the old, says Dr. Hans Jürgen Ahrens. However, the doctor asks critically why every skier, windsurfer or tennis player takes training lessons with a professional at the beginning, but often not the inline skater: The risk of injury can be significantly reduced by regular driving training. In a course, the most important falling, braking and driving techniques should be learned.",
        "correct_answer": "g",
        "explanation": "The passage argues that people should take training courses for inline skating just like they do for skiing or tennis to reduce injuries. This matches 'g' (Leisure sports should also be trained).",
        "vocabulary": [
          {
            "de": "der Ausdauersport",
            "en": "the endurance sport"
          },
          {
            "de": "das Verletzungsrisiko",
            "en": "the risk of injury"
          }
        ]
      },
      {
        "number": 4,
        "text": "Eine Studie der Fernsehgesellschaften ARD und ZDF besagt, dass deutsche Internetnutzer sich auch mit anderen Dingen beschäftigen, wenn sie im Internet sind. Ein Großteil der beobachteten Personen telefoniert beim Surfen, hört nebenbei Musik oder arbeitet mit anderen Computerprogrammen. Aber auch Konkurrenzmedien wie Fernsehen und Zeitschriften finden große Aufmerksamkeit, während im Internet nach Informationen gesucht wird.",
        "text_en": "A study by the television companies ARD and ZDF states that German internet users also occupy themselves with other things when they are on the internet. A large part of the observed persons talk on the phone while surfing, listen to music on the side or work with other computer programs. But competing media such as television and magazines also receive a great deal of attention while information is being searched for on the internet.",
        "correct_answer": "e",
        "explanation": "The text describes how internet users multitask (listening to music, watching TV, calling). This fits heading 'e' (Internet users do many things at the same time).",
        "vocabulary": [
          {
            "de": "die Aufmerksamkeit",
            "en": "the attention"
          },
          {
            "de": "nebenbei",
            "en": "on the side / casually"
          }
        ]
      },
      {
        "number": 5,
        "text": "Geschäfte über das Internet werden in Deutschland auch in Zukunft Milliarden Euro einbringen. In spätestens zwei Jahren werden 20 Prozent aller europäischen Geschäfte über das Internet abgewickelt, sagen die Fachleute. Heutzutage ist es kaum vorstellbar, dass ein Unternehmen allein mit klassischen Verkaufsmethoden und ohne zusätzliches Online-Marketing erfolgreich sein wird. Wer heute nicht anfängt, diese Möglichkeiten zu nutzen, kann in Zukunft seine Kunden verlieren. Das Argument, dass die angebotene Ware sich ja auch ohne Internet gut verkaufe, stimmt so nicht mehr. Denn das Internet beeinflusst auch das Käuferverhalten auf der Straße.",
        "text_en": "Business over the internet will continue to bring in billions of euros in Germany in the future. In at most two years, 20 percent of all European business will be transacted via the internet, say the experts. Nowadays it is hard to imagine that a company will be successful with classic sales methods alone and without additional online marketing. Those who do not start using these possibilities today may lose their customers in the future. The argument that the offered goods sell well even without the internet is no longer true. Because the internet also influences buyer behavior on the street.",
        "correct_answer": "f",
        "explanation": "The text warns that companies must use online marketing and cannot rely solely on classic sales methods. This matches 'f' (Companies must also advertise products via the internet).",
        "vocabulary": [
          {
            "de": "abwickeln",
            "en": "to transact / process"
          },
          {
            "de": "vorstellbar",
            "en": "imaginable"
          }
        ]
      }
    ]
  },
  "leseverstehen_teil_2": {
    "passage": {
      "headline": "Computerkurse sind schon für Kinder spannend",
      "subheadline": "Schreiben, Rechnen, Programme installieren",
      "paragraphs": [